{
  "schema_version": 1,
  "target_date": "2026-08-12",
  "sources": [
    {
      "source_ref": "JPX_LISTED_COMPANY-7203-company_name",
      "source_id": "JPX_LISTED_COMPANY",
      "source_role": "PRIMARY",
      "information_type": "LISTED_COMPANY",
      "source_status": "FOUND",
      "source_name": "Jpx Listed Company",
      "source_url": "https://www.jpx.co.jp/listing/co-search/",
      "retrieved_at": "2026-08-10T20:00:00+09:00",
      "trading_date": "2026-08-10",
      "ticker": "7203",
      "field_name": "company_name",
      "value": "Example Co."
    },
    {
      "source_ref": "JPX_LISTED_COMPANY-7203-market",
      "source_id": "JPX_LISTED_COMPANY",
      "source_role": "PRIMARY",
      "information_type": "LISTED_COMPANY",
      "source_status": "FOUND",
      "source_name": "Jpx Listed Company",
      "source_url": "https://www.jpx.co.jp/listing/co-search/",
      "retrieved_at": "2026-08-10T20:00:00+09:00",
      "trading_date": "2026-08-10",
      "ticker": "7203",
      "field_name": "market",
      "value": "TSE Prime"
    },
    {
      "source_ref": "JPX_TRADING_UNIT-7203-share_unit",
      "source_id": "JPX_TRADING_UNIT",
      "source_role": "PRIMARY",
      "information_type": "TRADING_UNIT",
      "source_status": "FOUND",
      "source_name": "Jpx Trading Unit",
      "source_url": "https://www.jpx.co.jp/equities/trading/domestic/03.html",
      "retrieved_at": "2026-08-10T20:00:00+09:00",
      "trading_date": "2026-08-10",
      "ticker": "7203",
      "field_name": "share_unit",
      "value": "100"
    },
    {
      "source_ref": "YAHOO_JP_HISTORY-7203-open",
      "source_id": "YAHOO_JP_HISTORY",
      "source_role": "PRIMARY",
      "information_type": "OHLCV",
      "source_status": "FOUND",
      "source_name": "Yahoo Jp History",
      "source_url": "https://finance.yahoo.co.jp/quote/7203.T/history",
      "retrieved_at": "2026-08-10T20:00:00+09:00",
      "trading_date": "2026-08-10",
      "ticker": "7203",
      "field_name": "open",
      "value": "2500"
    },
    {
      "source_ref": "KABUTAN_HISTORY-7203-open",
      "source_id": "KABUTAN_HISTORY",
      "source_role": "SECONDARY",
      "information_type": "OHLCV",
      "source_status": "FOUND",
      "source_name": "Kabutan History",
      "source_url": "https://kabutan.jp/stock/kabuka?code=7203",
      "retrieved_at": "2026-08-10T20:00:00+09:00",
      "trading_date": "2026-08-10",
      "ticker": "7203",
      "field_name": "open",
      "value": "2500"
    },
    {
      "source_ref": "YAHOO_JP_HISTORY-7203-high",
      "source_id": "YAHOO_JP_HISTORY",
      "source_role": "PRIMARY",
      "information_type": "OHLCV",
      "source_status": "FOUND",
      "source_name": "Yahoo Jp History",
      "source_url": "https://finance.yahoo.co.jp/quote/7203.T/history",
      "retrieved_at": "2026-08-10T20:00:00+09:00",
      "trading_date": "2026-08-10",
      "ticker": "7203",
      "field_name": "high",
      "value": "2600"
    },
    {
      "source_ref": "KABUTAN_HISTORY-7203-high",
      "source_id": "KABUTAN_HISTORY",
      "source_role": "SECONDARY",
      "information_type": "OHLCV",
      "source_status": "FOUND",
      "source_name": "Kabutan History",
      "source_url": "https://kabutan.jp/stock/kabuka?code=7203",
      "retrieved_at": "2026-08-10T20:00:00+09:00",
      "trading_date": "2026-08-10",
      "ticker": "7203",
      "field_name": "high",
      "value": "2600"
    },
    {
      "source_ref": "YAHOO_JP_HISTORY-7203-low",
      "source_id": "YAHOO_JP_HISTORY",
      "source_role": "PRIMARY",
      "information_type": "OHLCV",
      "source_status": "FOUND",
      "source_name": "Yahoo Jp History",
      "source_url": "https://finance.yahoo.co.jp/quote/7203.T/history",
      "retrieved_at": "2026-08-10T20:00:00+09:00",
      "trading_date": "2026-08-10",
      "ticker": "7203",
      "field_name": "low",
      "value": "2480"
    },
    {
      "source_ref": "KABUTAN_HISTORY-7203-low",
      "source_id": "KABUTAN_HISTORY",
      "source_role": "SECONDARY",
      "information_type": "OHLCV",
      "source_status": "FOUND",
      "source_name": "Kabutan History",
      "source_url": "https://kabutan.jp/stock/kabuka?code=7203",
      "retrieved_at": "2026-08-10T20:00:00+09:00",
      "trading_date": "2026-08-10",
      "ticker": "7203",
      "field_name": "low",
      "value": "2480"
    },
    {
      "source_ref": "YAHOO_JP_HISTORY-7203-close",
      "source_id": "YAHOO_JP_HISTORY",
      "source_role": "PRIMARY",
      "information_type": "OHLCV",
      "source_status": "FOUND",
      "source_name": "Yahoo Jp History",
      "source_url": "https://finance.yahoo.co.jp/quote/7203.T/history",
      "retrieved_at": "2026-08-10T20:00:00+09:00",
      "trading_date": "2026-08-10",
      "ticker": "7203",
      "field_name": "close",
      "value": "2550"
    },
    {
      "source_ref": "KABUTAN_HISTORY-7203-close",
      "source_id": "KABUTAN_HISTORY",
      "source_role": "SECONDARY",
      "information_type": "OHLCV",
      "source_status": "FOUND",
      "source_name": "Kabutan History",
      "source_url": "https://kabutan.jp/stock/kabuka?code=7203",
      "retrieved_at": "2026-08-10T20:00:00+09:00",
      "trading_date": "2026-08-10",
      "ticker": "7203",
      "field_name": "close",
      "value": "2550"
    },
    {
      "source_ref": "YAHOO_JP_HISTORY-7203-volume",
      "source_id": "YAHOO_JP_HISTORY",
      "source_role": "PRIMARY",
      "information_type": "OHLCV",
      "source_status": "FOUND",
      "source_name": "Yahoo Jp History",
      "source_url": "https://finance.yahoo.co.jp/quote/7203.T/history",
      "retrieved_at": "2026-08-10T20:00:00+09:00",
      "trading_date": "2026-08-10",
      "ticker": "7203",
      "field_name": "volume",
      "value": "3000000"
    },
    {
      "source_ref": "KABUTAN_HISTORY-7203-volume",
      "source_id": "KABUTAN_HISTORY",
      "source_role": "SECONDARY",
      "information_type": "OHLCV",
      "source_status": "FOUND",
      "source_name": "Kabutan History",
      "source_url": "https://kabutan.jp/stock/kabuka?code=7203",
      "retrieved_at": "2026-08-10T20:00:00+09:00",
      "trading_date": "2026-08-10",
      "ticker": "7203",
      "field_name": "volume",
      "value": "3000000"
    },
    {
      "source_ref": "YAHOO_JP_HISTORY-7203-previous_close",
      "source_id": "YAHOO_JP_HISTORY",
      "source_role": "PRIMARY",
      "information_type": "OHLCV",
      "source_status": "FOUND",
      "source_name": "Yahoo Jp History",
      "source_url": "https://finance.yahoo.co.jp/quote/7203.T/history",
      "retrieved_at": "2026-08-10T20:00:00+09:00",
      "trading_date": "2026-08-10",
      "ticker": "7203",
      "field_name": "previous_close",
      "value": "2500"
    },
    {
      "source_ref": "KABUTAN_HISTORY-7203-previous_close",
      "source_id": "KABUTAN_HISTORY",
      "source_role": "SECONDARY",
      "information_type": "OHLCV",
      "source_status": "FOUND",
      "source_name": "Kabutan History",
      "source_url": "https://kabutan.jp/stock/kabuka?code=7203",
      "retrieved_at": "2026-08-10T20:00:00+09:00",
      "trading_date": "2026-08-10",
      "ticker": "7203",
      "field_name": "previous_close",
      "value": "2500"
    },
    {
      "source_ref": "YAHOO_JP_HISTORY-7203-previous_high",
      "source_id": "YAHOO_JP_HISTORY",
      "source_role": "PRIMARY",
      "information_type": "OHLCV",
      "source_status": "FOUND",
      "source_name": "Yahoo Jp History",
      "source_url": "https://finance.yahoo.co.jp/quote/7203.T/history",
      "retrieved_at": "2026-08-10T20:00:00+09:00",
      "trading_date": "2026-08-10",
      "ticker": "7203",
      "field_name": "previous_high",
      "value": "2600"
    },
    {
      "source_ref": "KABUTAN_HISTORY-7203-previous_high",
      "source_id": "KABUTAN_HISTORY",
      "source_role": "SECONDARY",
      "information_type": "OHLCV",
      "source_status": "FOUND",
      "source_name": "Kabutan History",
      "source_url": "https://kabutan.jp/stock/kabuka?code=7203",
      "retrieved_at": "2026-08-10T20:00:00+09:00",
      "trading_date": "2026-08-10",
      "ticker": "7203",
      "field_name": "previous_high",
      "value": "2600"
    },
    {
      "source_ref": "JPX_TICK_SIZE-7203-tick_size",
      "source_id": "JPX_TICK_SIZE",
      "source_role": "PRIMARY",
      "information_type": "TICK_SIZE",
      "source_status": "FOUND",
      "source_name": "Jpx Tick Size",
      "source_url": "https://www.jpx.co.jp/equities/trading/domestic/07.html",
      "retrieved_at": "2026-08-10T20:00:00+09:00",
      "trading_date": "2026-08-10",
      "ticker": "7203",
      "field_name": "tick_size",
      "value": "1"
    },
    {
      "source_ref": "JPX_TOPIX500-7203-topix500_membership",
      "source_id": "JPX_TOPIX500",
      "source_role": "PRIMARY",
      "information_type": "TOPIX500_MEMBERSHIP",
      "source_status": "FOUND",
      "source_name": "Jpx Topix500",
      "source_url": "https://www.jpx.co.jp/markets/indices/topix/",
      "retrieved_at": "2026-08-10T20:00:00+09:00",
      "trading_date": "2026-08-10",
      "ticker": "7203",
      "field_name": "topix500_membership",
      "value": "true"
    },
    {
      "source_ref": "src-7203-turnover",
      "source_id": "YAHOO_JP_QUOTE",
      "source_role": "PRIMARY",
      "information_type": "TURNOVER",
      "source_status": "FOUND",
      "source_name": "Yahoo Jp Quote",
      "source_url": "https://finance.yahoo.co.jp/quote/7203.T",
      "retrieved_at": "2026-08-10T20:00:00+09:00",
      "trading_date": "2026-08-10",
      "ticker": "7203",
      "field_name": "turnover",
      "value": "50000000"
    }
  ],
  "source_attempts": [
    {
      "attempt_id": "jpx_earnings-7203",
      "source_id": "JPX_EARNINGS_SCHEDULE",
      "source_role": "PRIMARY",
      "criticality": "RULE_DEPENDENT",
      "information_type": "EARNINGS_SCHEDULE",
      "candidate_code": "7203",